{
  "schema_version": 1,
  "stage": "2O-D1-B1",
  "classification": "blocked",
  "upstream": {
    "repository": "beamguides/beam-patcher",
    "commit": "feed97887090d121f796bc1b941390e28b7a2da5",
    "source_digest": "4f405c9ecfb2f505d99b00bc77468961e3aa98c72f9ec30faa3939849465b9d5"
  },
  "tested_toolchain": {
    "rust": "1.77.2",
    "cargo": "1.77.2",
    "host": "x86_64-pc-windows-msvc"
  },
  "cargo_lock": {
    "origin": "generated-by-faithro-for-compatibility-test",
    "official_lockfile_found": false,
    "sha256": "fe0bb3a8f6f1d95084eb96b7a80bb6c17a2fd87b2b5d2f2bc4392c332df39101",
    "git_dependencies": 0,
    "registry_sources": [
      "registry+https://github.com/rust-lang/crates.io-index"
    ]
  },
  "metadata": {
    "exit_code": 101,
    "succeeded": false
  },
  "primary_blocker": {
    "crate": "zeroize",
    "version": "1.9.0",
    "edition": "2024",
    "required_rust": "1.85",
    "reason": "edition2024 is unsupported by Cargo 1.77.2"
  },
  "additional_confirmed_msrv": [
    {
      "crate": "potential_utf",
      "version": "0.1.5",
      "required_rust": "1.82"
    },
    {
      "crate": "windows-strings",
      "version": "0.5.1",
      "required_rust": "1.82"
    },
    {
      "crate": "writeable",
      "version": "0.6.3",
      "required_rust": "1.82"
    },
    {
      "crate": "zerotrie",
      "version": "0.2.4",
      "required_rust": "1.82"
    },
    {
      "crate": "zerovec",
      "version": "0.11.6",
      "required_rust": "1.83"
    }
  ],
  "build_started": false,
  "binary_produced": false,
  "binary_executed": false,
  "dependencies_modified": false,
  "toolchain_elevated": false,
  "deploy_performed": false,
  "vps_accessed": false,
  "next_authorization_required": true
}
